{
  "$schema": "http://json-schema.org/draft-07/schema#",
  "$id": "https://github.com/arkade-os/solver-registry/schema/index.schema.json",
  "title": "Per-network market index",
  "description": "Reduced, flattened output for one network: <network>.json",
  "type": "object",
  "additionalProperties": false,
  "required": [
    "version",
    "network",
    "generated_at",
    "commit",
    "markets"
  ],
  "definitions": {
    "asset": {
      "type": "object",
      "additionalProperties": false,
      "required": [
        "id",
        "name",
        "ticker",
        "decimals"
      ],
      "properties": {
        "id": {
          "type": "string",
          "pattern": "^(btc|[0-9a-f]{68})$",
          "description": "DEPRECATED shape, restored for the v0 compatibility window: \"btc\" or a 68-hex AssetId. The reducer down-projects the card's CAIP-19 id into this field because a v0 client validates it and rejects the ENTIRE index when it fails, which would cost every solver on the network its listing. Read caip19_id for the real identity; this field returns to CAIP-19 when the window closes."
        },
        "caip19_id": {
          "type": "string",
          "pattern": "^(arkade:(?:bitcoin/slip44:0|(?:signet|mutinynet|regtest)/slip44:1)|arkade:(?:bitcoin|signet|mutinynet|regtest)/asset:[0-9a-f]{68}|bolt11:(?:bitcoin/slip44:0|(?:signet|mutinynet|regtest)/slip44:1)|bolt11:(?:bitcoin|signet|mutinynet|regtest)/asset:[0-9a-f]{68}|bitcoin:(?:bitcoin/slip44:0|(?:signet|mutinynet|regtest)/slip44:1)|bitcoin:(?:bitcoin|signet|mutinynet|regtest)/asset:[0-9a-f]{68}|eip155:[1-9][0-9]{0,31}/slip44:(?:0|[1-9][0-9]{0,9})|eip155:[1-9][0-9]{0,31}/erc20:0x[0-9a-f]{40})$",
          "description": "Canonical CAIP-19 asset identity, carried alongside the down-projected id for the duration of the v0 compatibility window. Authoritative when present: the chain namespace IS the corridor. Absent only on a market with no v0 form, which is held out of the index entirely."
        },
        "name": {
          "type": "string",
          "minLength": 1,
          "maxLength": 64
        },
        "ticker": {
          "type": "string",
          "minLength": 1,
          "maxLength": 16
        },
        "decimals": {
          "type": "integer",
          "minimum": 0,
          "maximum": 18
        }
      }
    },
    "priceFeedSchema": {
      "type": "object",
      "additionalProperties": false,
      "required": [
        "type",
        "price_path"
      ],
      "properties": {
        "type": {
          "const": "json",
          "description": "The price feed response is JSON."
        },
        "price_path": {
          "type": "string",
          "pattern": "^(?:/(?:[^~/]|~0|~1)*)*$",
          "description": "RFC 6901 JSON Pointer to the numeric feed value, e.g. /price or /bitcoin/usd. Empty string selects the whole JSON document."
        }
      }
    },
    "corridor": {
      "type": "string",
      "enum": [
        "arkade",
        "lightning",
        "onchain",
        "eip155"
      ],
      "description": "DEPRECATED, removed a release after the CAIP-19 cutover: the rail a market side settles on, under its v0 name. Absent means \"arkade\". Derived by the reducer from the side's asset id chain namespace, which is canonical: bolt11 reports as \"lightning\" and bitcoin as \"onchain\", the names v0 consumers match on. \"eip155\" has no v0 name and reports as itself, so a v0 consumer's corridor checks exclude it."
    },
    "amount": {
      "type": "string",
      "pattern": "^(0|[1-9][0-9]{0,29})$",
      "description": "A canonical decimal-string amount of atomic units: unsigned, no leading zeros. \"0\" disables the side it bounds."
    },
    "enabledAmount": {
      "type": "string",
      "pattern": "^[1-9][0-9]{0,29}$",
      "description": "An amount that is strictly positive: the side it bounds is enabled."
    },
    "solverFeeSide": {
      "type": "object",
      "additionalProperties": false,
      "properties": {
        "bps": {
          "type": "integer",
          "minimum": 0,
          "maximum": 10000,
          "description": "This direction's spread. OPTIONAL; absent falls back to fee_bps, which equals the widest spread declared here."
        },
        "flat": {
          "allOf": [
            {
              "$ref": "#/definitions/amount"
            }
          ],
          "description": "The size-independent part, in atomic units of the side this sits under. OPTIONAL; absent means none."
        }
      },
      "description": "One direction's whole fee, selected by the side the maker DEPOSITS."
    }
  },
  "properties": {
    "version": {
      "const": 0
    },
    "network": {
      "type": "string",
      "enum": [
        "bitcoin",
        "signet",
        "mutinynet",
        "regtest"
      ]
    },
    "generated_at": {
      "type": "integer",
      "minimum": 0,
      "description": "Unix seconds, set by CI."
    },
    "commit": {
      "type": "string",
      "pattern": "^[0-9a-f]{40}$"
    },
    "markets": {
      "type": "array",
      "items": {
        "type": "object",
        "additionalProperties": false,
        "required": [
          "solver",
          "base_asset",
          "quote_asset",
          "fee_bps",
          "min_base_amount",
          "max_base_amount",
          "min_quote_amount",
          "max_quote_amount"
        ],
        "anyOf": [
          {
            "properties": {
              "max_base_amount": {
                "$ref": "#/definitions/enabledAmount"
              }
            }
          },
          {
            "properties": {
              "max_quote_amount": {
                "$ref": "#/definitions/enabledAmount"
              }
            }
          }
        ],
        "properties": {
          "solver": {
            "type": "string",
            "pattern": "^[a-z0-9-]+$"
          },
          "base_asset": {
            "$ref": "#/definitions/asset"
          },
          "quote_asset": {
            "$ref": "#/definitions/asset"
          },
          "pair": {
            "type": "string",
            "pattern": "^((lightning|onchain|eip155):)?[A-Za-z0-9._-]{1,16}/((lightning|onchain|eip155):)?[A-Za-z0-9._-]{1,16}$",
            "description": "DEPRECATED, removed a release after the CAIP-19 cutover: display pair \"<base-label>/<quote-label>\", where a side's label is its ticker on the arkade corridor and \"<corridor>:<ticker>\" otherwise. Derived by the reducer from base_asset.id and quote_asset.id, which are the canonical identity \u2014 read those instead."
          },
          "base_corridor": {
            "$ref": "#/definitions/corridor"
          },
          "quote_corridor": {
            "$ref": "#/definitions/corridor"
          },
          "discovery_pubkey": {
            "type": "string",
            "pattern": "^[0-9a-f]{64}$"
          },
          "transports": {
            "type": "object",
            "additionalProperties": false,
            "required": [
              "nostr"
            ],
            "minProperties": 1,
            "properties": {
              "nostr": {
                "type": "object",
                "required": [
                  "relays"
                ],
                "properties": {
                  "relays": {
                    "type": "array",
                    "minItems": 1,
                    "maxItems": 8,
                    "items": {
                      "type": "string",
                      "format": "uri",
                      "pattern": "^wss?://"
                    }
                  }
                }
              }
            },
            "description": "The solver card's v0 transport map, propagated by the reducer when present. Nostr is the only supported protocol key."
          },
          "price_feed": {
            "type": "string",
            "format": "uri",
            "pattern": "^https?://",
            "description": "Present on cross-asset markets only; absent on same-asset corridor markets, whose price is identically 1."
          },
          "price_feed_schema": {
            "$ref": "#/definitions/priceFeedSchema"
          },
          "price_decimals": {
            "type": "integer",
            "minimum": -18,
            "maximum": 18,
            "description": "The feed value divided by 10^price_decimals is the price in quote-atomic-units per base-atomic-unit. Negative when the quote asset has more decimals than the base (dividing by 10^-n multiplies by 10^n)."
          },
          "fee_bps": {
            "type": "integer",
            "minimum": 0,
            "maximum": 10000
          },
          "fee_flat": {
            "allOf": [
              {
                "$ref": "#/definitions/amount"
              }
            ],
            "description": "The part of the price that does not scale with size, in quote-asset atomic units. OPTIONAL; absent means none. Carried through from the solver's card unchanged."
          },
          "solver_fee": {
            "type": "object",
            "additionalProperties": false,
            "properties": {
              "base": {
                "$ref": "#/definitions/solverFeeSide"
              },
              "quote": {
                "$ref": "#/definitions/solverFeeSide"
              }
            },
            "description": "The solver's whole fee, keyed by the side the maker DEPOSITS. Exactly one key applies per swap, and that key fixes the units for everything under it. SUPERSEDES fee_flat where present and is never summed with it. OPTIONAL. Carried through from the solver's card unchanged."
          },
          "charges_delivered_carrier": {
            "type": "boolean",
            "description": "Whether the solver charges the maker for the dust carrier it delivers when the maker RECEIVES an Arkade asset. A pricing input, not a fee. OPTIONAL; absent means it does not charge. Carried through from the solver's card unchanged."
          },
          "min_base_amount": {
            "allOf": [
              {
                "$ref": "#/definitions/amount"
              }
            ],
            "description": "Lower trade-size bound for the base side, in base atomic units. An enabled side has 1 <= min <= max; when the side is disabled (max = \"0\") min MUST be \"0\"."
          },
          "max_base_amount": {
            "allOf": [
              {
                "$ref": "#/definitions/amount"
              }
            ],
            "description": "Upper trade-size bound for the base side, in base atomic units. \"0\" disables the side: the solver does not pay out base and makers cannot receive it."
          },
          "min_quote_amount": {
            "allOf": [
              {
                "$ref": "#/definitions/amount"
              }
            ],
            "description": "Lower trade-size bound for the quote side, in quote atomic units. An enabled side has 1 <= min <= max; when the side is disabled (max = \"0\") min MUST be \"0\"."
          },
          "max_quote_amount": {
            "allOf": [
              {
                "$ref": "#/definitions/amount"
              }
            ],
            "description": "Upper trade-size bound for the quote side, in quote atomic units. \"0\" disables the side: the solver does not pay out quote and makers cannot receive it."
          }
        }
      }
    },
    "solvers": {
      "type": "array",
      "description": "Every listed solver with a discovery_pubkey (pointer cards always, full cards when they carry one), sorted by name. A client resolves each one's signed card over its transports; a pointer's markets exist only there.",
      "items": {
        "type": "object",
        "additionalProperties": false,
        "required": [
          "name",
          "discovery_pubkey"
        ],
        "properties": {
          "name": {
            "type": "string",
            "pattern": "^[a-z0-9-]+$"
          },
          "discovery_pubkey": {
            "type": "string",
            "pattern": "^[0-9a-f]{64}$"
          },
          "transports": {
            "$ref": "#/properties/markets/items/properties/transports"
          }
        }
      }
    }
  }
}
