{
  "version": 0,
  "network": "signet",
  "generated_at": 1700000000,
  "commit": "aaaaaaaaaaaaaaaaaaaaaaaaaaaaaaaaaaaaaaaa",
  "markets": [
    {
      "base_asset": {
        "id": "btc",
        "name": "Bitcoin",
        "ticker": "BTC",
        "decimals": 8,
        "caip19_id": "arkade:signet/slip44:1"
      },
      "quote_asset": {
        "id": "btc",
        "name": "Bitcoin",
        "ticker": "BTC",
        "decimals": 8,
        "caip19_id": "bitcoin:signet/slip44:1"
      },
      "fee_bps": 40,
      "min_base_amount": "0",
      "max_base_amount": "0",
      "min_quote_amount": "20000",
      "max_quote_amount": "1000000",
      "solver": "signed-solver",
      "pair": "BTC/onchain:BTC",
      "quote_corridor": "onchain",
      "discovery_pubkey": "dff1d77f2a671c5f36183726db2341be58feae1da2deced843240f7b502ba659",
      "transports": {
        "nostr": {
          "relays": [
            "wss://relay.example.com",
            "wss://relay2.example.com"
          ]
        }
      }
    },
    {
      "base_asset": {
        "id": "btc",
        "name": "Bitcoin",
        "ticker": "BTC",
        "decimals": 8,
        "caip19_id": "arkade:signet/slip44:1"
      },
      "quote_asset": {
        "id": "btc",
        "name": "Bitcoin",
        "ticker": "BTC",
        "decimals": 8,
        "caip19_id": "bolt11:signet/slip44:1"
      },
      "fee_bps": 25,
      "min_base_amount": "1000",
      "max_base_amount": "5000000",
      "min_quote_amount": "1000",
      "max_quote_amount": "5000000",
      "solver": "signed-solver",
      "pair": "BTC/lightning:BTC",
      "quote_corridor": "lightning",
      "discovery_pubkey": "dff1d77f2a671c5f36183726db2341be58feae1da2deced843240f7b502ba659",
      "transports": {
        "nostr": {
          "relays": [
            "wss://relay.example.com",
            "wss://relay2.example.com"
          ]
        }
      }
    },
    {
      "base_asset": {
        "id": "btc",
        "name": "Bitcoin",
        "ticker": "BTC",
        "decimals": 8,
        "caip19_id": "bolt11:signet/slip44:1"
      },
      "quote_asset": {
        "id": "btc",
        "name": "Bitcoin",
        "ticker": "BTC",
        "decimals": 8,
        "caip19_id": "bitcoin:signet/slip44:1"
      },
      "fee_bps": 40,
      "min_base_amount": "0",
      "max_base_amount": "0",
      "min_quote_amount": "1000",
      "max_quote_amount": "2000000",
      "solver": "signed-solver",
      "pair": "lightning:BTC/onchain:BTC",
      "base_corridor": "lightning",
      "quote_corridor": "onchain",
      "discovery_pubkey": "dff1d77f2a671c5f36183726db2341be58feae1da2deced843240f7b502ba659",
      "transports": {
        "nostr": {
          "relays": [
            "wss://relay.example.com",
            "wss://relay2.example.com"
          ]
        }
      }
    }
  ],
  "solvers": [
    {
      "name": "signed-solver",
      "discovery_pubkey": "dff1d77f2a671c5f36183726db2341be58feae1da2deced843240f7b502ba659",
      "transports": {
        "nostr": {
          "relays": [
            "wss://relay.example.com",
            "wss://relay2.example.com"
          ]
        }
      }
    }
  ]
}
